{
  "schemaVersion": "2026-06-05.research.deep-research-publication-precheck.v1",
  "precheckInvocationId": "deep_research_publication_precheck_inv_001",
  "principal": {
    "principalId": "teacher_research_reviewer_001",
    "role": "TEACHER",
    "subjectType": "USER",
    "entryPoint": "DESKTOP_RESEARCH",
    "scopes": ["RESEARCH_READ", "RESEARCH_WRITE", "KNOWLEDGE_PRIVATE_READ"],
    "sessionId": "research_publication_precheck_session_001"
  },
  "renderPreviewRecord": {
    "schemaVersion": "2026-06-05.research.deep-research-render-preview-recorded.v1",
    "runtimeId": "research_deep_research_render_preview_runtime",
    "commandPort": "DeepResearchRenderPreviewPort.recordDeepResearchRenderPreview",
    "status": "RENDER_PREVIEW_READY_NOT_PUBLISHED",
    "recordId": "research_deep_research_render_preview_deep-research-render-preview_job-001",
    "job": {
      "taskId": "agent_task_research_deep_001",
      "contextRef": "shared_ctx_research_deep_001",
      "jobId": "deep_research_job_001",
      "queueName": "research_deep_research"
    },
    "preview": {
      "previewId": "deep_research_render_preview_001",
      "previewKind": "EVIDENCE_GROUNDED_RESEARCH_PREVIEW",
      "audience": "TEACHER_REVIEW",
      "format": "SAFE_TEXT_BLOCKS",
      "deliveryState": "PREVIEW_READY_NOT_PUBLISHED",
      "title": "个性化学习与智能教研助手的证据草稿",
      "summary": "当前证据支持把个性化辅导建立在可追踪的学习档案、检索证据和效果指标上。",
      "claims": [
        {
          "claimId": "claim_001",
          "text": "个性化辅导能力需要绑定明确的学习结果指标。",
          "citations": ["public_curriculum_knowledge#source:public-curriculum:001"],
          "sourceHashes": ["sha256:aaaaaaaaaaaaaaaaaaaaaaaaaaaaaaaaaaaaaaaaaaaaaaaaaaaaaaaaaaaaaaaa"],
          "supportChunkIds": ["chunk_public_001"],
          "confidence": 0.82,
          "evidencePreserved": true
        },
        {
          "claimId": "claim_002",
          "text": "私密知识库内容进入综合草稿时必须保留引用和 sourceHash。",
          "citations": ["private_research_notes#source:private-notes:001"],
          "sourceHashes": ["sha256:bbbbbbbbbbbbbbbbbbbbbbbbbbbbbbbbbbbbbbbbbbbbbbbbbbbbbbbbbbbbbbbb"],
          "supportChunkIds": ["chunk_private_001"],
          "confidence": 0.86,
          "evidencePreserved": true
        }
      ],
      "limitations": ["该草稿只覆盖已检索到的两个证据片段。", "最终发布仍需后续审批边界。"],
      "review": {
        "reviewRecordId": "research_deep_research_final_answer_review_deep-research-final-answer-review_job-001",
        "reviewerPrincipalId": "teacher_research_reviewer_001"
      },
      "finalization": {
        "artifactId": "deep_research_finalization_artifact_001",
        "finalizerPrincipalId": "teacher_research_reviewer_001",
        "deliveryState": "FINALIZED_NOT_PUBLISHED"
      },
      "integrity": {
        "claimCount": 2,
        "citationCount": 2,
        "sourceHashCount": 2,
        "unsafeTextEncoded": true
      }
    },
    "evidenceRefs": ["evidence:render-preview:job-001", "evidence:runtime:research_deep_research_render_preview_runtime"],
    "boundary": {
      "finalizedArtifactVerified": true,
      "reasoningSynthesisVerified": true,
      "citationIntegrityPreserved": true,
      "sourceHashIntegrityPreserved": true,
      "unsafeTextEncoded": true,
      "renderPreviewRecorded": true,
      "publicationCandidateCreated": false,
      "finalAnswerPublished": false,
      "studentVisible": false,
      "directPublicationAllowed": false,
      "externalModelCallStarted": false,
      "mainDatabaseWriteStarted": false,
      "studentArchiveWriteStarted": false,
      "remoteDeviceControlAllowed": false,
      "localToolMutationAllowed": false,
      "swarmAllowed": false,
      "requiresFuturePublicationReview": true
    }
  },
  "publicationPrecheckPolicy": {
    "renderPreviewRequired": true,
    "humanPublicationReviewRequired": true,
    "evidenceIntegrityRequired": true,
    "safetyReviewRequired": true,
    "studentVisibilityReviewRequired": true,
    "deliveryRuntimeRequired": true,
    "directPublicationAllowed": false,
    "studentVisibleDeliveryAllowed": false,
    "directDatabaseAccessAllowed": false,
    "mainDatabaseWriteAllowed": false,
    "studentArchiveWriteAllowed": false,
    "externalModelCallAllowed": false,
    "remoteDeviceControlAllowed": false,
    "localToolMutationAllowed": false,
    "swarmAllowed": false
  },
  "precheck": {
    "precheckId": "deep_research_publication_precheck_001",
    "reviewerPrincipalId": "teacher_research_reviewer_001",
    "decision": "APPROVED_FOR_DELIVERY_RUNTIME",
    "reviewedAt": "2026-06-05T00:00:00.000Z",
    "evidenceIntegrityReviewed": true,
    "safetyReviewed": true,
    "studentVisibilityReviewed": true,
    "limitationsReviewed": true,
    "risk": {
      "hallucinationRisk": "LOW",
      "privateKnowledgeRisk": "MEDIUM",
      "studentDataRisk": "LOW",
      "publicationRisk": "LOW"
    },
    "comments": "Preview is safe to enter a future delivery runtime, but is not delivered by this precheck."
  },
  "evidenceRefs": ["evidence:render-preview:job-001", "evidence:publication-precheck:desktop-research"],
  "idempotencyKey": "deep-research-publication-precheck:job-001"
}
